{
  "schema": "dubsar.s1.egress-policy.v1",
  "contract_version": "1.0.0",
  "policy_id": "dubsar.gateway.probe.v1",
  "destination": {
    "service_ref": "dubsar.gateway",
    "scheme": "https",
    "peer_ref": "dubsar.gateway.s1"
  },
  "operation": {
    "method": "POST",
    "path": "/v1/chat/completions"
  },
  "gateway_scope": {
    "profile_id": "dubsar.s1.synthetic.v1",
    "context_id": "ctx-s1-synthetic",
    "model": "dubsar-s1-synthetic"
  },
  "request_digest": "sha256:54a7dd941aeed59511616f98305061340ecda46db80fb3c8836056dfa38515c7",
  "bounds": {
    "max_attempts": 1,
    "window_seconds": 30,
    "request_timeout_ms": 2000,
    "max_request_bytes": 4096,
    "max_response_bytes": 16384,
    "max_generation_tokens": 128
  },
  "protocol": {
    "retry": false,
    "redirect": false,
    "connect": false,
    "streaming": false,
    "tools": false
  },
  "authentication": "outside_workload_ephemeral",
  "revocation": "core_bound_session"
}
